review_id,rating,date,review_text,date_parsed,year
ChZDSUhNMG9nS0VJQ0FnSUNlbWRYQVF3EAE,5,3 years ago,Baru sekali malam minggu jalan-jalan sambil kuliner di dekat alun-alun.. ternyata pas diterapkan car free night.. main nyelonong ae di semprit petugas.. 😀 …,2023-01-18 08:03:10.617067,2023
ChZDSUhNMG9nS0VJQ0FnSURRX2ZHRlJnEAE,5,7 years ago,"Mantab,pemandangannya sip,tatanannya bagus,jadi enak untuk dibuat bersantai sama keluarga.dan mobil,sepeda motor aman sudah ada tukang parkir yg menjaga.mantab alun²Lumajang",2019-01-18 08:03:10.617067,2019
ChdDSUhNMG9nS0VJQ0FnSURtNzhpejZ3RRAB,3,3 years ago,"Seneng ramah anak,sangat disayangkan masih kurang kesadaran pengunjung saat membuang sampah padahal sudah disediakan tempat sampah",2023-01-18 08:03:10.617067,2023
ChdDSUhNMG9nS0VJQ0FnSUQtZzktNXBnRRAB,5,3 years ago,"Tempat nya bersih, rapi dan bagus  setiap pagi dan sore banyak warga yg berolah,...",2023-01-18 08:03:10.617067,2023
ChdDSUhNMG9nS0VJQ0FnSURBbnZlQWt3RRAB,4,8 years ago,"Tempat ini jauh lebih baik dari sebelumnya..,dulu terkesan suram,dan tidak nyaman sekarang bisa enjoy dan bisa bermain berasama anak anak....,baru di resmikan tgl 1 januari kemarin...,adanya air mancur yang membikin anak anak …",2018-01-18 08:03:10.617067,2018
ChZDSUhNMG9nS0VJQ0FnSUQyeE5DbUhnEAE,5,3 years ago,"Tempat bersih, banyak pilihan jajanan buat anak2 maupun dewasa. Tempat duduk yang teduh sebaiknya ditambah",2023-01-18 08:03:10.617067,2023
ChZDSUhNMG9nS0VJQ0FnSUNBeVktNVRREAE,1,8 years ago,"Terdapat air mancur dengan lampu laser di empat sudutnya, sangat menarik untuk wisatawa  domestik bisa sekalian sholat di masjid agung Anas Mahfud.",2018-01-18 08:03:10.617067,2018
ChdDSUhNMG9nS0VJQ0FnSUNHeGU3YzR3RRAB,5,4 years ago,Sangat menyenangkan buat sekedar refreshing.,2022-01-18 08:03:10.617067,2022
ChZDSUhNMG9nS0VJQ0FnSUNpM1BuM2N3EAE,3,5 years ago,"Seharusnya kalau malam minggu semua lampu di hidupin
Untuk yang lainya sudah bagus, cuma lampunya aja yang kurang terang",2021-01-18 08:03:10.617067,2021
ChdDSUhNMG9nS0VJQ0FnSUNRNjdxZG1nRRAB,4,7 years ago,Alun- alun kota Lumajang ternyata sekarang sangat menyenangkan. Selain nyaman untuk jalan- jalan santai bersama keluarga di sore hari kita juga dapat menikmati keindahan tamannya. Ini perlu dipertahankan bahkan kalau bisa ditingkatkan terus agar warga semakin puas.,2019-01-18 08:03:10.617067,2019
ChZDSUhNMG9nS0VJQ0FnSUQ2dU55VlhnEAE,5,4 years ago,"Nyaman, asri, sejuk yg biasanya ditengah kota panas, di Lumajang tengah kota nya malah adem sejuk sesuai dengan kondisi iklim dan cuaca disana sih😁 …",2022-01-18 08:03:10.617067,2022
ChdDSUhNMG9nS0VJQ0FnSUNsbnVlRXN3RRAB,3,2 years ago,"Dulu dingin, tapi sekarang hawanya panas karena sudah tidak ada pohon beringin.",2024-01-18 08:03:10.617067,2024
Ci9DQUlRQUNvZENodHljRjlvT2tWUFdYRkliMHRZWjBGSlVEYzFaamRZYUZCMFdGRRAB,5,3 months ago,Alun-alun penuh kenangan,2025-10-18 08:03:10.617067,2025
ChdDSUhNMG9nS0VJQ0FnSURNdnBMR3R3RRAB,3,6 years ago,"Refresing mlm thn anyar
2020 sepi.",2020-01-18 08:03:10.617067,2020
ChdDSUhNMG9nS0VJQ0FnSURVdGVlbGlRRRAB,4,6 years ago,"Nyaman, rindang, tempat bermain untuk anak"" banyak. Malam hari juga oke. Ada bnyk lampu di air mancur.",2020-01-18 08:03:10.617067,2020
ChZDSUhNMG9nS0VJQ0FnSUNvODhxOWRREAE,5,6 years ago,"Tempat yang sangat indah,yang letaknya berada di pusat kota kabupaten lumajang,tempat yang sangat baik untuk acara keluarga,bahkan di sini juga terdapat wahana untuk anak anak kecil dan free wifi dan tempat yang menerapkan konsep adwiyata.",2020-01-18 08:03:10.617067,2020
ChdDSUhNMG9nS0VJQ0FnSUNKdFpQQjNnRRAB,5,2 years ago,"Bagus, rame juga toilet juga ada. Mau jajan apa juga ada tapi kalo malem penerangannya kurang😊 …",2024-01-18 08:03:10.617067,2024
ChZDSUhNMG9nS0VJQ0FnSUNJNHFleFF3EAE,4,7 years ago,"A great nice view, very nice actually. It just rain tonight. Makes people stay at home as most prefered place rather in outdoor. Usually peoples were crowd in every corner, but tonight is rainy night.",2019-01-18 08:03:10.617067,2019
ChZDSUhNMG9nS0VJQ0FnSURneU5TWEtnEAE,4,8 years ago,"Dengan beberapa perubahan wajah pada taman disekitar alun-alun, menjadikan lokasi ini semakin banyak dikunjungi masyarakat. Disarankan datang tidak pada malam minggu mengingat pada malam itu semakin ramai",2018-01-18 08:03:10.617067,2018
ChZDSUhNMG9nS0VJQ0FnSURnNnRtbkZREAE,5,7 years ago,Malam yang berhias warna warni cahaya...sangat ideal utk bersantai dan d sekeliling nya banyak terdapat kuliner bernagai pilihan sesuai selera anda..,2019-01-18 08:03:10.617067,2019
ChdDSUhNMG9nS0VJQ0FnSUMwX2JXdXZ3RRAB,5,6 years ago,Menyuport anak-anak PORSENI MI tingkat Jatim,2020-01-18 08:03:10.617067,2020
ChZDSUhNMG9nS0VJQ0FnSUQ2eTRIc09BEAE,2,4 years ago,"Penjual gak ada d dalam alun2, gak kayak alun2 ttngga jualannya d tengah alun2. Mnding alun2 yg dlu sblm d rombak masih asri dan lebih nyaman di zaman pak fauzi😁 …",2022-01-18 08:03:10.617067,2022
Ci9DQUlRQUNvZENodHljRjlvT2pOUFRVSkxVVlpXVTBSWldGaHlZMjVLU2pkaWNVRRAB,4,a week ago,Orangnya ramah ramah,2026-01-11 08:03:10.617067,2026
ChZDSUhNMG9nS0VJQ0FnSUNBeGRTMWJnEAE,5,7 years ago,"ALUN - ALUN Kab.Lumajang tahun 2018 Bagus untuk Wisata Keluarga Lengkap ada tempat bermain Anak2 , ada tempat terapi bagi orang tua dan tak kalah bagusnya yaitu air mancur di kasi sinar laser yg bikin indah,jembatannya dihiasu lampu warna …",2019-01-18 08:03:10.617067,2019
ChdDSUhNMG9nS0VJQ0FnSUR5NWNpcGpBRRAB,5,4 years ago,"Bagus bgt, penataan ruang sangat indah. Penjual disekitar alun2 juga tertib dengan berjualan di tempat yg sudah disediakan",2022-01-18 08:03:10.617067,2022
ChdDSUhNMG9nS0VJQ0FnSUNnMzdUUjV3RRAB,3,9 years ago,"Pusat kota Lumajang yg dapat juga dijadikan tempat rekreasi keluarga ini memiliki trotoar yang lebar. Pejalan kaki bisa dengan leluasa berjalan di sana. Namun, sayang, tempat parkir kendaraannya kurang tersedia sehingga pengunjung harus memarkir kendaraannya di badan jalan dan di bangunan sekitar Alun-alun.",2017-01-18 08:03:10.617067,2017
ChdDSUhNMG9nS0VJQ0FnSUNaNVl5d2pBRRAB,4,2 years ago,"Penerangan kurang, tapi banyak PKL yg tertata rapi. Cocok untuk kuliner ato ngemil malam",2024-01-18 08:03:10.617067,2024
ChZDSUhNMG9nS0VJQ0FnSURtX2JYTFdREAE,4,3 years ago,"Great place for hangout with fams and friends. Especially in the Sunday morning there are a lot of food stalls, many sport activities, community activities, etc ( such as a little bazaar). …",2023-01-18 08:03:10.617067,2023
ChZDSUhNMG9nS0VJQ0FnSURNeDRTM2JBEAE,5,5 years ago,Tempat santai dengan keluarga menghilangkan capek seharian dengan lihat air mancur berjoget. Anak anak pun bisa main sepuasnya tanpa ada ada rasa takut,2021-01-18 08:03:10.617067,2021
ChdDSUhNMG9nS0VJQ0FnSURDNXU2eGxBRRAB,4,Edited 5 years ago,"nyaman dech, utk istirahat di tengah kota, pohon beringin peninggalan masa   Belanda tetap dipertahankan, bikin makin anggung dan instagramable",2026-01-18 08:03:10.617067,2026
ChZDSUhNMG9nS0VJQ0FnSUN3NHVqZkJnEAE,5,8 years ago,"Tempat nongkrong yg asyik..di hari Minggu juga ada car free day,seru sekali.Terdapat air mancur menari,dan jg banyak spot untuk ber selfie",2018-01-18 08:03:10.617067,2018
ChdDSUhNMG9nS0VJQ0FnSUNnNTlYQWxnRRAB,4,8 years ago,Tempatnya bagus pemandangan juga Alhamdulillah sangat cocok untuk jalan jalan dikala sore maupun malam namun jika siang hari akan terasa kurang begitu memikat,2018-01-18 08:03:10.617067,2018
ChZDSUhNMG9nS0VJQ0FnSURBc01paURnEAE,4,7 years ago,"Disana....   kita bisa jalan² pada hari minggu pagi, berfoto-foto, bermain, dll....
Lebih bagusnya pada waktu malam hari, kita bisa melihat lampu berkelap-kelip menghiasi langit.....",2019-01-18 08:03:10.617067,2019
ChdDSUhNMG9nS0VJQ0FnSUN3eWRyY2xnRRAB,5,8 years ago,"Indah, rindang dan bersih seperti slogannya atip berseri...... 👍👍👍 …",2018-01-18 08:03:10.617067,2018
ChdDSUhNMG9nS0VJQ0FnSUN3NV9iS3BnRRAB,4,7 years ago,"Tempat eksitis nan indah penuh lampu yang berkerlap kerlip menyilaujan mata, sangat mempesona. Sulit dilupakan mungkin kalau lihat sekali saja pasti  kurang dach, lumajang kota pisang, kota salak ok.",2019-01-18 08:03:10.617067,2019
Ci9DQUlRQUNvZENodHljRjlvT21SVGEyMUJOVzh6TkV4V1VGWk9aamxGY1ZvM2ExRRAB,5,5 months ago,Tempatnya cantik,2025-08-18 08:03:10.617067,2025
ChdDSUhNMG9nS0VJQ0FnSURNa0xUeDJBRRAB,5,6 years ago,Tempat yg nyaman untuk bersantai dengan keluarga. Ditambah dg adanya area bermain untuk anak2. Semakin menjadi daya tarik tersendiri.,2020-01-18 08:03:10.617067,2020
ChdDSUhNMG9nS0VJQ0FnSURqczY3aWxBRRAB,1,a year ago,Alun alun lumajang kunjungan pertama di Masjid dekat alun alun...mengesankan,2025-01-18 08:03:10.617067,2025
ChdDSUhNMG9nS0VJQ0FnSUM0bVlfaHV3RRAB,5,6 years ago,"Tempat yang ramah anak, bisa untuk agenda keluarga. Ada beberapa permainan untuk anak-anak. Tersedia play ground juga. Spot untuk foto-foto juga oke..",2020-01-18 08:03:10.617067,2020
ChZDSUhNMG9nS0VJQ0FnSUNJektIWUxnEAE,4,Edited 6 years ago,Ada wahana mainan d area playground yang kurang aman... entah dilepas ato gmn.. bs jatuh tuh anak kecil apabila tidak diperhatikan,2026-01-18 08:03:10.617067,2026
ChdDSUhNMG9nS0VJQ0FnSURNdk5UenZBRRAB,4,6 years ago,"Sangat menarik, terutama buat momong anak anak",2020-01-18 08:03:10.617067,2020
ChZDSUhNMG9nS0VJQ0FnSURYeVptS0FnEAE,5,a year ago,Tempat bersih,2025-01-18 08:03:10.617067,2025
ChdDSUhNMG9nS0VJQ0FnSUQ0OG9uZ3FnRRAB,5,6 years ago,"Yaa seperti yang kalian ketahui, bahwa alun-alun itu  merupakan tempat dimana banyak orang melakukan berbagai aktivitas, seperti nongkrong, membeli makanan serta memakannya, berolahraga, dan masih banyak lagi. Naah di Lumajang, alun-alun …",2020-01-18 08:03:10.617067,2020
ChZDSUhNMG9nS0VJQ0FnSURDcE9yVlJREAE,4,5 years ago,"Bagus sebenarnya ,material yg dipakai kurang mewah ,contoh kolam air mancur bibir kolam bukan keramik ,kelihatan murahan ,tapi bagus scr umum",2021-01-18 08:03:10.617067,2021
ChdDSUhNMG9nS0VJQ0FnSUNqdkp1S3h3RRAB,5,a year ago,"Bagus, perlu banyak penataan ulang, terutama area air mancur",2025-01-18 08:03:10.617067,2025
ChdDSUhNMG9nS0VJQ0FnSUNuNTRmMDJBRRAB,5,a year ago,Tempat yang enak untuk jalan jalan melepaskan lelah setelah bekerja,2025-01-18 08:03:10.617067,2025
ChdDSUhNMG9nS0VJQ0FnSUR1dGNLcmpnRRAB,5,3 years ago,"Selalu berpartisipasi dalam kegiatan Lomba dan Berani Berkompetisi, bersaing dengan sekolah Sekolah baik Negeri maupun Swasta lainnya.. keren pkok.e josss",2023-01-18 08:03:10.617067,2023
ChZDSUhNMG9nS0VJQ0FnSUNIc0t1WldREAE,5,a year ago,"temptnya luas dan bagus, pemandangannya bagus, banyak bunga,,bunga,,, seperti di taman eropa",2025-01-18 08:03:10.617067,2025
ChZDSUhNMG9nS0VJQ0FnSUQ2eGJEMEdnEAE,4,Edited 3 years ago,"Tempatnya sangat luas, cukup bersih, rindang, asri, banyak burung dan ada beberapa tempat berfoto yang bagus👍🏼 …",2026-01-18 08:03:10.617067,2026
ChdDSUhNMG9nS0VJQ0FnSURtdk9fcXh3RRAB,3,3 years ago,Tempat dan sarana yg bagus ; tpi masih perlu kesadaran pengunjung dgn membuang sampah pada tempatnya,2023-01-18 08:03:10.617067,2023
ChdDSUhNMG9nS0VJQ0FnSUNJNFluSDZBRRAB,5,7 years ago,"I was there at night, but the park is still stunning. The light and plant are there great. Arround the park, it has alot of traditional foods and baverages. And also there is a (i think) the biggest mosque in town. I hope anybody else is also enjoy there",2019-01-18 08:03:10.617067,2019
ChZDSUhNMG9nS0VJQ0FnSUNNaWJicEpREAE,5,Edited 5 years ago,"Tempat menarik yang wajib di kunjungi saat ke Lumajang. alun alun lumajang adalah tempat ruang terbuka yang hijau yang dimiliki dan bisa digunakan untuk bersantai, berolah raga dan berbagai aktifitas lainnya, dan pada hari tertentu tempat ini juga digunakan upacara kemerdekaan dan upacara hari penting lainnya",2026-01-18 08:03:10.617067,2026
ChdDSUhNMG9nS0VJQ0FnSUNnd19DeXNnRRAB,5,7 years ago,Tempatnya nyaman.  Apalagi malam hari,2019-01-18 08:03:10.617067,2019
ChdDSUhNMG9nS0VJQ0FnSURnMzl6MjNBRRAB,3,Edited 7 years ago,"Saya dan beberapa teman kerapkali ke tempat ini. Karena beberapa teman saya ada yang tinggal di Lumajang, maka alun-alun Lumajang menjadi salah satu tempat wajib yang saya kunjungi. Alun-alun ini lumayan bagus untuk dijadikan tempat …",2026-01-18 08:03:10.617067,2026
ChZDSUhNMG9nS0VJQ0FnSUNRaXQyLUZREAE,3,8 years ago,Usahakn d setiap temp terpasang CCV,2018-01-18 08:03:10.617067,2018
ChZDSUhNMG9nS0VJQ0FnSURZNzZtRmR3EAE,5,Edited 5 years ago,"Tempatnya bagus , nyaman , & tenang. Apalagi anak - anak senang sekali kalau diajak kesini. betah & gak pengen pulang.",2026-01-18 08:03:10.617067,2026
ChZDSUhNMG9nS0VJQ0FnSURrdl9hTGFBEAE,5,6 years ago,Hiburan dimalam hari tuk keluarga,2020-01-18 08:03:10.617067,2020
ChdDSUhNMG9nS0VJQ0FnSURNNi1TMzJBRRAB,5,5 years ago,"Rapi,indah,adem,sejuk,bagusss bangett pokoknya ❤️ Lumajang sae",2021-01-18 08:03:10.617067,2021
ChdDSUhNMG9nS0VJQ0FnSURNaHZIc253RRAB,5,6 years ago,"Bagus, banyak tempat bermain untuk anak kecil, pedangan kecil disekitaran alun2 jg cukup banyak, dekat masjid",2020-01-18 08:03:10.617067,2020
ChZDSUhNMG9nS0VJQ0FnSUQyenZ6TUhnEAE,5,3 years ago,Kulinernya yang langka dan banyak pilihan. waktu terbaik untuk mengunjungi ini adalah malam hari. kelebihan lain yaitu bebas sampah.,2023-01-18 08:03:10.617067,2023
ChZDSUhNMG9nS0VJQ0FnSUNteTluclZ3EAE,5,4 years ago,Tempat nyaman buat nongkrong,2022-01-18 08:03:10.617067,2022
ChZDSUhNMG9nS0VJQ0FnSURBdTZEZFd3EAE,5,Edited a year ago,"Tempat yg indah, nyaman, sejuk dan bagus. Cocok buat liburan keluarga. Untuk yg mau kesana bisa siang dan malam. Klu mau liat air mancur yg indah silahkan dtang dimalam hari.",2026-01-18 08:03:10.617067,2026
ChdDSUhNMG9nS0VJQ0FnSUNvN3FmRl9BRRAB,5,6 years ago,Bagus...tempatnya rame..,2020-01-18 08:03:10.617067,2020
ChdDSUhNMG9nS0VJQ0FnSUNXemFxYTVBRRAB,5,3 years ago,Landmark Kabupaten Lumajang. Dengan pembangunan nya kini terlihat lebih modern. Nmun sayang pohon beringin yang berusia ratusan tahun harus tumbang karena angin besar waktu lalu. Ini yang mungkin harus menjadi catatan bagi Pemkab Lumajang,2023-01-18 08:03:10.617067,2023
ChdDSUhNMG9nS0VJQ0FnSURVM295RXVBRRAB,5,Edited 3 years ago,"Ada toilet didalam area,fasilitas duduk lumayan, disekitar alun2 ada tempat kuliner yang recommended",2026-01-18 08:03:10.617067,2026
ChZDSUhNMG9nS0VJQ0FnSUNCem8tY01BEAE,3,3 years ago,alun-alun..tertata rapi tp lingkungan di sekitar alun2 yg kurang tertata...seperti parkiran yg semrawut...dan sering terjadi kemacetan pada jam2 pulang sekolah....dan ruas jalan yg sempit jika sdh di gunakan area parkir...,2023-01-18 08:03:10.617067,2023
ChZDSUhNMG9nS0VJQ0FnSUNKdmU3UUJBEAE,5,2 years ago,"Alun - alun lumajang adalah tempat yang sangat menyenangkan bagi anggota keluarga untuk berrekreasi bersama karena didukung dengan adanya tempat bermain untuk anak-anak, remaja dan dewasa atau orang tua.",2024-01-18 08:03:10.617067,2024
ChZDSUhNMG9nS0VJQ0FnSURDaF83Wk1BEAE,5,Edited 5 years ago,"Bagus apalagi pas musim pandemi sekarang, kursi nggak ada dan ada palang juga di pintu masuk dan keluar jadi aman deh",2026-01-18 08:03:10.617067,2026
ChdDSUhNMG9nS0VJQ0FnSUNvM3ZqNzd3RRAB,5,Edited 5 years ago,"Pantas menyandang gelar sebagai salah satu alun-alun terindah, karena spot fotonya banyak, bersih, dan terletak di tengah kota, ada berbagai macam wahana juga",2026-01-18 08:03:10.617067,2026
ChZDSUhNMG9nS0VJQ0FnSUNkc0tPaVRREAE,4,a year ago,Tempatnya bersih dan nyaman,2025-01-18 08:03:10.617067,2025
ChdDSUhNMG9nS0VJQ0FnSURVNzRHbzRnRRAB,5,6 years ago,"Alun alunya semakin bagus setelah direnovasi, dengan penambahan air mancur serta hiasab berupa bunga sakura, dan juga penambahan playground yang ramah buat anak kecil",2020-01-18 08:03:10.617067,2020
ChZDSUhNMG9nS0VJQ0FnSUNxaUpXMGF3EAE,3,4 years ago,"Alun-alun lumajang saat ini terlihat biasa saja. Hanya saja cocok untuk kegiatan olahraga, upacara, bukan untuk wisata atau bahkan sebagai ciri khas kota lumajang, tidak ada yang spesial baik dari segi fasilitas, maupun pemandangannya",2022-01-18 08:03:10.617067,2022
ChdDSUhNMG9nS0VJQ0FnSUNvNGU3SXpRRRAB,5,6 years ago,Indah bak wisata reliji,2020-01-18 08:03:10.617067,2020
ChdDSUhNMG9nS0VJQ0FnSUNCbS1ycXl3RRAB,5,3 years ago,Baru kali ini saya bisa menjumpai alun-alun yang lahan parkirnya (parkir motor) tidak memakan badan jalan dan ada lahan sendiri. Keren!,2023-01-18 08:03:10.617067,2023
Ci9DQUlRQUNvZENodHljRjlvT2xSNVRrRmlNRE42ZW5SVmNubFJlVFppU2pGc1RrRRAB,5,5 months ago,"Alun-alun kota yang asri, bersih dan indah",2025-08-18 08:03:10.617067,2025
ChdDSUhNMG9nS0VJQ0FnSURVMjVuNG13RRAB,4,6 years ago,"Tempat yg bersih, aman dan nyaman utk bersantai dan jalan2 bersama keluarga. Khususnya di pagi dan sore hari",2020-01-18 08:03:10.617067,2020
ChdDSUhNMG9nS0VJQ0FnSURVMDhyNDhBRRAB,5,6 years ago,"Taman tertata rapi, bersih, ada playground untuk bermain anak dan setiap sore ada pertunjukan air mancur",2020-01-18 08:03:10.617067,2020
ChdDSUhNMG9nS0VJQ0FnSUNOZ09yWGxnRRAB,5,2 years ago,Fasilitas parkir gratis ada taman bermain yg bagus untuk anak2.,2024-01-18 08:03:10.617067,2024
ChdDSUhNMG9nS0VJQ0FnSUNRamVydWhRRRAB,5,7 years ago,Sebelah barat dari alun-alun Lumajang ada masjid Jamik KH.ANAS MAHFUDZ. Kalau pagi hari akses masuk dari depan sering terhalang dengan parkir sepeda motor.Sahabat yg mau sholat Dhuha lewat dari pintu sebelah kiri (selatan). Parkir dihalaman masjid GRATIS...,2019-01-18 08:03:10.617067,2019
ChZDSUhNMG9nS0VJQ0FnSURJaXVQUlVREAE,5,Edited 7 years ago,"Alun-alun Lumajang terletak di tengah-tengah kota. Memiliki halaman yang luas, pemandangan yg hijau, Rindang nan sejuk. Banyak permainan Anak-anak,  fasilitas umum seperti toilet dekat dengan masjid tempat olahraga, tempat untuk berfoto dan …",2026-01-18 08:03:10.617067,2026
ChdDSUhNMG9nS0VJQ0FnSUNPNDhqandBRRAB,4,3 years ago,Untuk menumbuh kembangkan kreatifitas masyarakat kegiatan tsb perlu ditingkatan berharap dapat meningkatkan ekonomi jauh lebih baik.,2023-01-18 08:03:10.617067,2023
ChdDSUhNMG9nS0VJQ0FnSUNRX19mcjRnRRAB,5,8 years ago,Bisa buat rekreasi keluarga. Piknik dan tamasya. Kalau malam ada air mancur warna warni dan komunitas sepatu roda berlatih,2018-01-18 08:03:10.617067,2018
ChdDSUhNMG9nS0VJQ0FnTUNJODRLRnVRRRAB,5,9 months ago,"Ramah anak, jajanannya murah dan ramah di kantong",2025-04-18 08:03:10.617067,2025
ChdDSUhNMG9nS0VJQ0FnSUNwc1Bid2hRRRAB,5,2 years ago,"Alun-alun Lumajang menurut saya merupakan salah satu alun-alun yang terbaik. Kawasan utamanya steril, punya ruang pejalan kaki yang sangat luas dan banyak pepohonan.",2024-01-18 08:03:10.617067,2024
ChdDSUhNMG9nS0VJQ0FnSURRNTU2dzh3RRAB,4,8 years ago,"Lokasix d tengah2 kota. Teduh, rindang, banyak pepohonan dan sarana hiburan anak2. Ada playground dan tempat olahraga untuk lansia, jogging track, air mancur dekat masjid agung dan sarana publik lainx_",2018-01-18 08:03:10.617067,2018
ChdDSUhNMG9nS0VJQ0FnSURnczlYOThRRRAB,5,7 years ago,Pas dibuat bersantai dan ngasuh anak istri,2019-01-18 08:03:10.617067,2019
ChdDSUhNMG9nS0VJQ0FnSUNiamI2cS1BRRAB,5,a year ago,Sekarang tersedianya wifi publik dapat dikases dengan mudah good job pemda,2025-01-18 08:03:10.617067,2025
ChdDSUhNMG9nS0VJQ0FnSURyNmVYYW5nRRAB,5,a year ago,"Tempat yang nyaman untuk family time ...
Tidak berat di ongkos dan dekat dengan sarana ibadah ...
👌👌👌 …",2025-01-18 08:03:10.617067,2025
ChdDSUhNMG9nS0VJQ0FnSURJdUluOXhnRRAB,5,Edited 6 years ago,"Sangat rapih, cocok untuk tamasya gratis saat liburan atau sore hari. Alun alun sangat bersih memang Icon Kabupaten Lumajang. Ada playgroundnya juga. Rindang juga tampatnya. Memang tepat untuk paru paru kota. Bangga banget jadi warga Lumajang. 👍👍👍👍👍 …",2026-01-18 08:03:10.617067,2026
ChdDSUhNMG9nS0VJQ0FnTUNJLV9LUmpRRRAB,5,9 months ago,Terbaik,2025-04-18 08:03:10.617067,2025
ChZDSUhNMG9nS0VJQ0FnSUNCMWYzbmJREAE,5,3 years ago,Alun² nya lmyn bs utk bersantai..yg jualan jg teratur. Bs buat kumpul bareng keluarga sambil santai.,2023-01-18 08:03:10.617067,2023
ChdDSUhNMG9nS0VJQ0FnSUN3dXJYeHJnRRAB,5,7 years ago,Senang sekali,2019-01-18 08:03:10.617067,2019
ChdDSUhNMG9nS0VJQ0FnSUN1MjZpZHVRRRAB,5,Edited a year ago,"Suka main kesini sih, rame , wisata kuliner, gratis pula",2026-01-18 08:03:10.617067,2026
ChdDSUhNMG9nS0VJQ0FnSUNXNGMzOThBRRAB,5,3 years ago,Alun-alun yang bagus dan termasuk alun-alun yang terbaik yang pernah saya kunjungi,2023-01-18 08:03:10.617067,2023
ChdDSUhNMG9nS0VJQ0FnSURTMDllQXNBRRAB,5,5 years ago,"Alun2 kenangan ku, kecilku, main air mancur, bal2 LAN, lomba layangan, lomba sawangan, sekarang bagus tertata..semoga kl sore masih ada yg sepak bola.dan olah raga lain..",2021-01-18 08:03:10.617067,2021
ChdDSUhNMG9nS0VJQ0FnSURna2FTMTZ3RRAB,5,7 years ago,"Taman rekreasi masyarakat lumajang yg menarik.
Saran utk pemda, semoga bs menempatkan penjual sekitar alun2 dgn mengelompokkannya pd satu lokasi tertentu, sehingga memberikan kenyamanan bagi pengunjung terutama utk org yg sekedar melintasi jalanan sekitar alun2.",2019-01-18 08:03:10.617067,2019
ChdDSUhNMG9nS0VJQ0FnSURoNjU2bXRnRRAB,5,2 years ago,"Bagus banget sih desainnya.. rapi, bersih, banyak juga wahananya.

Jajanan pinggir jalan juga tersedia disana.",2024-01-18 08:03:10.617067,2024
ChdDSUhNMG9nS0VJQ0FnSUNJemZHeTlnRRAB,5,7 years ago,"Banyak sekali kulinernya, mulai dari makanan berat, camilan, minuman yang diperjual belikan. Tamannya asri namun kekurangan tempat duduk untuk santai2.",2019-01-18 08:03:10.617067,2019
ChZDSUhNMG9nS0VJQ0FnSUMxcy12cURREAE,5,2 years ago,Dekat dengan tempat teman saya,2024-01-18 08:03:10.617067,2024
ChZDSUhNMG9nS0VJQ0FnSUN3LTVxOGFREAE,5,7 years ago,Alun alun dengan tampilan baru menyenangkan,2019-01-18 08:03:10.617067,2019
ChZDSUhNMG9nS0VJQ0FnSUNVdThlNVV3EAE,5,Edited 3 years ago,"Bagus lahh,,",2026-01-18 08:03:10.617067,2026
ChZDSUhNMG9nS0VJQ0FnSUQwcGQyRFZ3EAE,5,6 years ago,"Alun2 lumajang sangat enak buat santai keluarga,tempatnya adem cocok buat selfe dan apalagi di hari minggu pagi ada acara Car Free Day,banyak sajian kuliner disekitar lokasi CFD",2020-01-18 08:03:10.617067,2020
ChZDSUhNMG9nS0VJQ0FnSUNPakstMFFBEAE,5,3 years ago,Tempatnya bersih dan nyaman cocok buat liburan keluarga..banyak permainan anak anak jadi betah,2023-01-18 08:03:10.617067,2023
ChZDSUhNMG9nS0VJQ0FnSURNMzRteFhREAE,5,Edited 3 years ago,"Salah satu Icon Lumajang, tempatnya enak, go green, ada tempat bermain, sketboard, sepak bola dan lain lain.cuma banyak warga sekitar yang masih belum mempunyai kesadaran untuk menjaga alam.",2026-01-18 08:03:10.617067,2026
ChZDSUhNMG9nS0VJQ0FnSUNJbjR6WGJREAE,4,7 years ago,"Pertama kali saya kesana, saya terkesan karena sangat bersih, ada area bermain anak-anak, taman, dan area berolaraga. Cocok untuk tempat bersantai.",2019-01-18 08:03:10.617067,2019
ChZDSUhNMG9nS0VJQ0FnSURJM3BxZFVBEAE,4,7 years ago,"Kurang bersih, dan permainan anak yg rusak tdk diberesi. Mengganggu pemandangan. Penjual harusnya ditertibkan dagangannya",2019-01-18 08:03:10.617067,2019
ChdDSUhNMG9nS0VJQ0FnSURRNHJLcm93RRAB,4,9 years ago,"Alun-alun bersih, mungkin perlu dipertimbangkan untuk mendirikan sentra kuliner di sekitar alun-alun ini mengingat akses makanan juga dibutuhkan untuk menjaga perut para pengunjung.",2017-01-18 08:03:10.617067,2017
ChdDSUhNMG9nS0VJQ0FnSUNzaUtDTzVBRRAB,4,5 years ago,Bersih....hanya saja himbauan agar tidak merokok belum ada....secara live...sprti halnya di alun2 batu.,2021-01-18 08:03:10.617067,2021
ChZDSUhNMG9nS0VJQ0FnSUN5cklUdUVnEAE,5,4 years ago,"👍👍👍👍siip lorrr, py Sebelom reingine tumbang. Pa lagi klo air mancurnya ama wahana per mainan anak-anak di buka lagi , malah tambah jozzz gandozzz... …",2022-01-18 08:03:10.617067,2022
ChdDSUhNMG9nS0VJQ0FnSUNRbzRiWTdnRRAB,5,Edited 6 years ago,"Semakin rapi,bersih & indahh...",2026-01-18 08:03:10.617067,2026
ChZDSUhNMG9nS0VJQ0FnSURJcWFQelJREAE,5,7 years ago,"Bagud alun2nya, banyak acara, bisa olahrga. Setiap minggu pagi sampai jam 9 ada CFD. malam minggu ada CFN car free night.",2019-01-18 08:03:10.617067,2019
ChdDSUhNMG9nS0VJQ0FnSUNjbmRqWjNRRRAB,5,5 years ago,"JANTUNG KOTA 🌆
Kekuatan dari seorang sahabat adalah,  mereka mampu mengubah suasana hati yang amburadul (modat madut). menjadi 💡 terang benderang, bahagia dan tertawa lepas.. …",2021-01-18 08:03:10.617067,2021
ChdDSUhNMG9nS0VJQ0FnSURrdV9Da3lRRRAB,4,6 years ago,"Nyaman, cukup baik penataannya dan semakin indah saat malam hari dgn tata cahaya air mancurnya",2020-01-18 08:03:10.617067,2020
ChZDSUhNMG9nS0VJQ0FnSUM0dWZ5aFBBEAE,5,Edited 6 years ago,"Indah,nyaman buat bersantai",2026-01-18 08:03:10.617067,2026
Ci9DQUlRQUNvZENodHljRjlvT2s1Rk4xTTVMVVo1VVRkcmVFNWZhMjVLUkdGNlJrRRAB,5,3 months ago,Bersih banget,2025-10-18 08:03:10.617067,2025
ChZDSUhNMG9nS0VJQ0FnSUMycE03aU5BEAE,5,3 years ago,tempat sejuk parkir luas ada taman bermain anak2 cocok tuk olga senam dll.,2023-01-18 08:03:10.617067,2023
ChZDSUhNMG9nS0VJQ0FnSUQydHFENld3EAE,4,3 years ago,"Cocok buat olahraga atau sekedar jalan-jalan. Banyak akses juga ke mana-mana, dekat masjid dan bank, ada juga pmi dan gedung pemda.",2023-01-18 08:03:10.617067,2023
ChZDSUhNMG9nS0VJQ0FnSUN1aE1TbkhREAE,5,3 years ago,Cocok untuk piknik dan foto2 wkw,2023-01-18 08:03:10.617067,2023
ChRDSUhNMG9nS0VJQ0FnSUN3azZ4eBAB,5,7 years ago,Alun2 terbagus yg pernah q liat. N sekarang msh ada perbaikan lg padahal itu sudah bagus n trs menjadi bagus. Apalagi untuk yg suka selfie2. Cocok sekali,2019-01-18 08:03:10.621958,2019
ChZDSUhNMG9nS0VJQ0FnSUN5eFotYll3EAE,5,4 years ago,"Tempat nya gk bising
Deket ke alun² kota
Tempat nya bersih banget, karena setiap hari ada ibu² yg tukang bersih² ke …",2022-01-18 08:03:10.621958,2022
ChZDSUhNMG9nS0VJQ0FnSURtaHBPZktnEAE,5,Edited 3 years ago,Good bgt siii :),2026-01-18 08:03:10.621958,2026
ChdDSUhNMG9nS0VJQ0FnSURNb3ZDdHV3RRAB,5,6 years ago,"Seneng lihat alun2 Lumajang yang sangat bersih. Nyaman buat jalan2 bersama keluarga.
Lebih bersih dari Kota Bangkalan Madura tempat saya Tinggal sekarang.. andai kan Alun2 Bangkalan sama bersih nya dengan Alun2 Lumajang mungkin akan terasa nyaman",2020-01-18 08:03:10.621958,2020
