review_id,rating,date,review_text,date_parsed,year
ChZDSUhNMG9nS0VJQ0FnSUNVM2JYT0VBEAE,5,Edited 5 years ago,Alun-alun paling bagus di Jawa Timur,2026-01-18 08:03:10.653437,2026
ChdDSUhNMG9nS0VJQ0FnSURZN2V5aDlRRRAB,1,6 years ago,"Terlalu redup....dan pohon wringinnya terlalu terang, jadi kayak ngambek gitu😂😂😂 …",2020-01-18 08:03:10.653437,2020
ChZDSUhNMG9nS0VJQ0FnSUQ4bDktTUJBEAE,4,5 years ago,"Tempat ny istimewa,.. Lumayan untuk jalan jalan santai 😁 …",2021-01-18 08:03:10.653437,2021
ChdDSUhNMG9nS0VJQ0FnSUNBd1kzU2xnRRAB,5,8 years ago,Taman yg bagus dan nyaman untuk keluarga di saat ingin refreshing murah,2018-01-18 08:03:10.653437,2018
ChdDSUhNMG9nS0VJQ0FnSUMwMUpPSzlnRRAB,5,6 years ago,Sangat menyenangkan cocok untuk berkumpul dan berkunjung bersama keluarga,2020-01-18 08:03:10.653437,2020
ChZDSUhNMG9nS0VJQ0FnSUNDZ3BUSlVBEAE,5,5 years ago,Ramai pengunjung setiap ada cfd atau hari minggu pagi,2021-01-18 08:03:10.653437,2021
ChdDSUhNMG9nS0VJQ0FnSURBczVENTB3RRAB,5,7 years ago,Tempat yg baik untuk refreshing..banyak fasilitas olah raga,2019-01-18 08:03:10.653437,2019
ChdDSUhNMG9nS0VJQ0FnSUNncDdfVDZnRRAB,5,Edited 7 years ago,Tempat yang sangat bugus tuk nak anak sampai dewasa,2026-01-18 08:03:10.653437,2026
ChdDSUhNMG9nS0VJQ0FnSURBNWI2M3h3RRAB,5,8 years ago,"Buat sarana olahraga dan juga tempat berkumpulnya para komunitas, fans club dll",2018-01-18 08:03:10.653437,2018
ChZDSUhNMG9nS0VJQ0FnSUNRa0k3RkpREAE,4,7 years ago,Tempat yg asyik buat anak kecil bermain,2019-01-18 08:03:10.653437,2019
ChZDSUhNMG9nS0VJQ0FnSUNJNy12WFZnEAE,5,7 years ago,"Mantap lah, buat cfd an, adem banyak spot fotonya 😁 …",2019-01-18 08:03:10.653437,2019
ChZDSUhNMG9nS0VJQ0FnSUNBZ3NMekp3EAE,5,7 years ago,"Ramai, sangat atraktif, cocok untuk segala usia. Fasilitas juga cukup lengkap",2019-01-18 08:03:10.653437,2019
ChdDSUhNMG9nS0VJQ0FnSURtOXJ1MmlRRRAB,5,Edited 3 years ago,"Alun alun kota lumajang bagus,ada tempat santai keluarga,juga tempat bermain anak anak",2026-01-18 08:03:10.653437,2026
ChdDSUhNMG9nS0VJQ0FnSUNKdjk2RHd3RRAB,5,2 years ago,"Alun alun yg  sejuk...
Bnyk pohon ... Suasananya jadi rindang",2024-01-18 08:03:10.653437,2024
ChdDSUhNMG9nS0VJQ0FnSUNnNUpIZ3JRRRAB,5,Edited 8 years ago,Siang hari duduk di bangku taman.. ditemani semilir angin.. rileks bangeet,2026-01-18 08:03:10.653437,2026
ChdDSUhNMG9nS0VJQ0FnSUNob0tya3pnRRAB,5,2 years ago,Taman kota yg sejuk di dalam kota lumajang disebut alun àlun serbaguna sip josss,2024-01-18 08:03:10.653437,2024
ChdDSUhNMG9nS0VJQ0FnSURRM2Y3TGdRRRAB,4,Edited 7 years ago,"Menarik, tapi kurang penerangan di malam hari. Terutama di bagian tengah alun alun.",2026-01-18 08:03:10.653437,2026
ChdDSUhNMG9nS0VJQ0FnSUQtcHFxNC1BRRAB,5,3 years ago,Sangat bagus untuk membantu terhadap pencarian tempat,2023-01-18 08:03:10.653437,2023
ChZDSUhNMG9nS0VJQ0FnSUNMekplWWN3EAE,5,a year ago,fasilitas sangat bagus dan sangat memadai,2025-01-18 08:03:10.653437,2025
ChdDSUhNMG9nS0VJQ0FnSUNzbExQZ3NnRRAB,5,5 years ago,"Bagus, asri, indah, nyaman",2021-01-18 08:03:10.653437,2021
ChZDSUhNMG9nS0VJQ0FnSUNtNGFMUEJBEAE,5,4 years ago,Bersih dan luas,2022-01-18 08:03:10.653437,2022
ChZDSUhNMG9nS0VJQ0FnSUNBaXBDRmZnEAE,5,7 years ago,saya senang sekali karna bagus perkembangan setiap taunnya,2019-01-18 08:03:10.653437,2019
ChZDSUhNMG9nS0VJQ0FnSURRLTlQamZBEAE,5,7 years ago,Aku cinta Lumajang,2019-01-18 08:03:10.653437,2019
ChZDSUhNMG9nS0VJQ0FnSUNvX1ozNFhBEAE,5,6 years ago,CFN kemaren malem,2020-01-18 08:03:10.657287,2020
ChdDSUhNMG9nS0VJQ0FnSUNLNU56T21RRRAB,5,Edited 4 years ago,"Tempatnya bersih,,, tamannya indah,,, deket masjid,,, cocok untuk kongkow santai,,,",2026-01-18 08:03:10.657287,2026
ChZDSUhNMG9nS0VJQ0FnSUNZMm9haEdBEAE,5,6 years ago,Tempat enak di buat joging dan jalan jalan bawa anak kecil,2020-01-18 08:03:10.657287,2020
ChZDSUhNMG9nS0VJQ0FnTUNJdk03Z2ZREAE,5,9 months ago,"Playground, garden, mini zoo, skatepark.",2025-04-18 08:03:10.657287,2025
ChdDSUhNMG9nS0VJQ0FnSUNRajRfUzdBRRAB,5,7 years ago,Tempat favorit berolahraga,2019-01-18 08:03:10.657287,2019
ChZDSUhNMG9nS0VJQ0FnSUM0bDgyV1RREAE,5,6 years ago,"Alun"" kota yang indah, asri, terdapat fasilitas"" umum yang menarik & patut dikunjungi",2020-01-18 08:03:10.657287,2020
ChZDSUhNMG9nS0VJQ0FnSURnaWVEYVR3EAE,5,7 years ago,Bersih rapi dan tertata,2019-01-18 08:03:10.657287,2019
ChdDSUhNMG9nS0VJQ0FnTUNZbWZxb2lnRRAB,5,8 months ago,Melayani sepenuh hati,2025-05-18 08:03:10.657287,2025
ChdDSUhNMG9nS0VJQ0FnSURZbXBxbzB3RRAB,3,6 years ago,Bs untuk refresing gratis utk keluargs dg suasana rindsng dan sejuk,2020-01-18 08:03:10.657287,2020
ChdDSUhNMG9nS0VJQ0FnSURZbHFhYW1BRRAB,5,6 years ago,bagus.. asri... ada masjid besar di barat alun2,2020-01-18 08:03:10.657287,2020
ChZDSUhNMG9nS0VJQ0FnSURnMDlpYUxREAE,3,8 years ago,"Fungsi nya belum optimal, sbg RTH atau pusat kegiatan masyarakat lain?",2018-01-18 08:03:10.657287,2018
ChdDSUhNMG9nS0VJQ0FnSUNVbEkzc3VnRRAB,5,6 years ago,Bagus buat femeli dan bersantai. Banyak wahana buat anak,2020-01-18 08:03:10.657287,2020
ChdDSUhNMG9nS0VJQ0FnSUMweXY2SXBBRRAB,5,6 years ago,Gowes bareng tim cobra,2020-01-18 08:03:10.657287,2020
ChZDSUhNMG9nS0VJQ0FnSUQtb1BHdGJnEAE,1,3 years ago,bagus sekali dan tertarik singgah yg kedua,2023-01-18 08:03:10.657287,2023
ChZDSUhNMG9nS0VJQ0FnSUNjamNXd01BEAE,5,5 years ago,"Sejuk, bersih, luas Dan pasti wajib di kunjungi",2021-01-18 08:03:10.657287,2021
ChdDSUhNMG9nS0VJQ0FnSURRdTRHdzBBRRAB,4,7 years ago,"Ke Lumajang wajib mampir kesini, silakan foto sama patung kuda yang merupakan ikonnya Lumajang",2019-01-18 08:03:10.657287,2019
ChZDSUhNMG9nS0VJQ0FnSURvbjlTM0R3EAE,4,6 years ago,Bersih dan terawat. Termasuk salah satu alun-alun terbaik di Indonesia.,2020-01-18 08:03:10.657287,2020
ChdDSUhNMG9nS0VJQ0FnSUNHZ1lqTTNBRRAB,5,Edited 2 years ago,"Harjalu 768 ""Pagelaran Wayang Kulit""",2026-01-18 08:03:10.657287,2026
ChdDSUhNMG9nS0VJQ0FnSUM2Z05yXzJnRRAB,5,4 years ago,"Enak dan Adem bgt..
Tempatnya selalu bersih",2022-01-18 08:03:10.657287,2022
ChZDSUhNMG9nS0VJQ0FnTURvOFkyaU1nEAE,5,8 months ago,Pelayanan finance terbaik,2025-05-18 08:03:10.657287,2025
ChZDSUhNMG9nS0VJQ0FnSUNoNXBhZ0VREAE,5,2 years ago,Tempat yg sangat bagus untuk dikunjungi,2024-01-18 08:03:10.657287,2024
ChdDSUhNMG9nS0VJQ0FnSUNZOTdhNnRBRRAB,1,6 years ago,Peraturan pembuangan sampah masih blm teratur dan tertib,2020-01-18 08:03:10.657287,2020
ChZDSUhNMG9nS0VJQ0FnSURROTZuSUFREAE,5,8 years ago,Alun alun terkeren ada air mancurnya yg bisa menyala nyala,2018-01-18 08:03:10.657287,2018
ChZDSUhNMG9nS0VJQ0FnSUNna3NQbEtBEAE,4,8 years ago,"Saat ini alun-alun lumajang sangat inovatif, dengan adanya tarian air mancur dan kursi yang nyama.",2018-01-18 08:03:10.657287,2018
ChdDSUhNMG9nS0VJQ0FnSUN3M3Q3LXVnRRAB,5,7 years ago,"Spacy, good for children",2019-01-18 08:03:10.657287,2019
ChdDSUhNMG9nS0VJQ0FnSUN3eE9yVHRnRRAB,4,8 years ago,"tempat bagus, hanya saja kantong parkir berantakan",2018-01-18 08:03:10.657287,2018
ChdDSUhNMG9nS0VJQ0FnSUNnMjYzbHh3RRAB,5,7 years ago,Alun alun nya rame sekali. Banyak wahana dan spot buat foto foto,2019-01-18 08:03:10.657287,2019
ChZDSUhNMG9nS0VJQ0FnSUNBOThpNkZREAE,5,8 years ago,Bisa lihat air mancur yg bercahaya saat malam hari,2018-01-18 08:03:10.657287,2018
ChZDSUhNMG9nS0VJQ0FnSUNvNzdUUEhBEAE,4,6 years ago,"Banyak wahana mainan, banyak penjual makanan, bersih, toilet bersih..",2020-01-18 08:03:10.657287,2020
ChZDSUhNMG9nS0VJQ0FnSURjM01HQ1JnEAE,5,5 years ago,"Banyak pilihan arena permainan untuk anak-anak, pilihan liburan gratis di kota Lumajang",2021-01-18 08:03:10.657287,2021
ChdDSUhNMG9nS0VJQ0FnSUQwcExhRHJ3RRAB,4,6 years ago,Suasana adem bingit cocok tuk santai ma keluarga,2020-01-18 08:03:10.657287,2020
ChZDSUhNMG9nS0VJQ0FnSUQwamRqN1FnEAE,5,6 years ago,"Tempat yang sejuk, rindang. Sangat nyaman untuk merefresh diri",2020-01-18 08:03:10.657287,2020
ChdDSUhNMG9nS0VJQ0FnSURpbEtPbHNRRRAB,5,Edited 3 years ago,Alun alunya nyaman untuk bersantai bersih udaranya segar disana untuk jogging,2026-01-18 08:03:10.657287,2026
ChZDSUhNMG9nS0VJQ0FnSUQyMG8yOUl3EAE,4,3 years ago,tempat yang cocok buat melepas penat buat warga lumajang khususnya,2023-01-18 08:03:10.657287,2023
ChZDSUhNMG9nS0VJQ0FnSURZN1lLX0tnEAE,5,6 years ago,Acara musik patrol,2020-01-18 08:03:10.657287,2020
ChdDSUhNMG9nS0VJQ0FnSUNBenBDczVnRRAB,4,8 years ago,Cocok buat momong anak2 dan bersantai bersama keluarga..,2018-01-18 08:03:10.657287,2018
ChZDSUhNMG9nS0VJQ0FnSURJb0k3a05REAE,5,7 years ago,Tempat kontes Anthurium Ok.,2019-01-18 08:03:10.657287,2019
ChZDSUhNMG9nS0VJQ0FnSUNxMGEzNFV3EAE,4,4 years ago,Alun2 ya selayaknya alun2. Ada playgroundnya tapi masih disegel,2022-01-18 08:03:10.657287,2022
ChdDSUhNMG9nS0VJQ0FnSURRbEtXMG1BRRAB,2,7 years ago,Senang banget untuk anakku,2019-01-18 08:03:10.657287,2019
ChZDSUhNMG9nS0VJQ0FnSUNLa3JEWFp3EAE,5,4 years ago,Asri tempatnya..cocok buat selfie..hehehe,2022-01-18 08:03:10.657287,2022
ChZDSUhNMG9nS0VJQ0FnSUNRNjlyTUR3EAE,5,Edited 7 years ago,Ramai pengunjung setiap malam minggu dan hari libur sekolah,2026-01-18 08:03:10.657287,2026
ChdDSUhNMG9nS0VJQ0FnSURxc3VMRl9RRRAB,5,4 years ago,mantab sekali,2022-01-18 08:03:10.657287,2022
ChdDSUhNMG9nS0VJQ0FnSUNBb05yb3lRRRAB,5,7 years ago,"semakin lama semakin bagus, selalu ada renovasi, terimakasih bapak bupati",2019-01-18 08:03:10.657287,2019
ChdDSUhNMG9nS0VJQ0FnSURtOGJqTWhRRRAB,5,3 years ago,Tempat yang bersih dekat dengan masjid yg bagus,2023-01-18 08:03:10.657287,2023
ChdDSUhNMG9nS0VJQ0FnSUNBOGF6UDR3RRAB,5,8 years ago,Bersih dan sejuk,2018-01-18 08:03:10.657287,2018
ChZDSUhNMG9nS0VJQ0FnSUNZOFl6T0dnEAE,5,6 years ago,Semakin bagus tempatnya luwas rapi memuaskn para pengunjungnya,2020-01-18 08:03:10.657287,2020
ChZDSUhNMG9nS0VJQ0FnSUN3OXJ6YmF3EAE,5,8 years ago,Semakin cantik dg adanya banyak air mancur,2018-01-18 08:03:10.657287,2018
ChdDSUhNMG9nS0VJQ0FnSUNPdElfSGdBRRAB,4,3 years ago,"Tempat yang bagus untuk bersantai, olahraga, dan berkumpul.",2023-01-18 08:03:10.657287,2023
ChdDSUhNMG9nS0VJQ0FnSUNnbU9IZHVBRRAB,5,Edited 6 years ago,Banyak hal yang sudah diperbaiki dan semakin nyaman jalan-jalan disini,2026-01-18 08:03:10.657287,2026
ChdDSUhNMG9nS0VJQ0FnTUNBN3B5MGxBRRAB,5,11 months ago,Sangat menarik,2025-02-18 08:03:10.657287,2025
ChdDSUhNMG9nS0VJQ0FnSURtbHBTbG13RRAB,5,Edited 3 years ago,Acara karnaval dilumajang,2026-01-18 08:03:10.657287,2026
ChdDSUhNMG9nS0VJQ0FnSUNKamVfbTRnRRAB,5,2 years ago,"Go green, asri, cocok untuk jalan2 santai atau olahraga",2024-01-18 08:03:10.657287,2024
ChdDSUhNMG9nS0VJQ0FnSUNvaDZhUnZ3RRAB,5,Edited a year ago,Tempat bermain dg keluarga yang nyaman,2026-01-18 08:03:10.657287,2026
ChZDSUhNMG9nS0VJQ0FnSUNJbGU2LVJREAE,5,Edited 7 years ago,"Taman yg asri, tata kelola oke, ramah anak dan cocok utk keluarga",2026-01-18 08:03:10.657287,2026
ChdDSUhNMG9nS0VJQ0FnSURCeVB5N3pnRRAB,5,3 years ago,Senang sekali Di alun² lumajang menyediakan PLAYGRON untuk Anak²,2023-01-18 08:03:10.657287,2023
ChZDSUhNMG9nS0VJQ0FnSURRc3VtakJnEAE,4,7 years ago,Tempat refreshing yang indah...tapi kebersihan kurang terjaga,2019-01-18 08:03:10.657287,2019
ChZDSUhNMG9nS0VJQ0FnSURRbEtqZkJ3EAE,4,7 years ago,Tempatnya cukup bagus untuk melepaskan penat pikiran,2019-01-18 08:03:10.657287,2019
ChdDSUhNMG9nS0VJQ0FnSUQweVpQRjdBRRAB,5,6 years ago,Tempatnya adem banget dan bersih jadi pengen kesitu lagi,2020-01-18 08:03:10.657287,2020
ChdDSUhNMG9nS0VJQ0FnSUNpdnU2X3hnRRAB,5,5 years ago,Saya sangat suka alun alun Lumajang karna di sana sangat menyenangkan sekali dan juga Lumajang adalah kota favorit saya I LIKE LUMAJANG ❤️,2021-01-18 08:03:10.657287,2021
ChZDSUhNMG9nS0VJQ0FnSURHdGRQeVRnEAE,5,4 years ago,Tempat yang cocok untuk bersantai dan berolahraga dihari Minggu,2022-01-18 08:03:10.657287,2022
ChdDSUhNMG9nS0VJQ0FnSURBcllXUmxBRRAB,5,Edited 7 years ago,"Taman indah, Play ground bagus, tapi banyak pedagang kaki lima nya",2026-01-18 08:03:10.657287,2026
ChZDSUhNMG9nS0VJQ0FnSUNtNE1xYUJnEAE,2,4 years ago,Lokasi Rumah Pribadi dan Kantor Posyandu Anggur Dusun Pandansari Desa Tukum Kec. Tekung Kab. Lumajang,2022-01-18 08:03:10.657287,2022
ChdDSUhNMG9nS0VJQ0FnSURBNXI2ZTl3RRAB,2,7 years ago,"Kebersihan masih kurang, fasilitas mulai ada yg rusak",2019-01-18 08:03:10.657287,2019
ChdDSUhNMG9nS0VJQ0FnSUM3c3ZDYzBBRRAB,5,a year ago,Sangat memuaskan mobil bagus bagus,2025-01-18 08:03:10.657287,2025
ChdDSUhNMG9nS0VJQ0FnSUNTcTUtWjhBRRAB,5,5 years ago,Kalau pagi sejuk ada WiFi gratisnya juga hehe,2021-01-18 08:03:10.657287,2021
ChZDSUhNMG9nS0VJQ0FnSUN5dnFQMU9nEAE,5,4 years ago,"Icon kota lumajang, tempat nyaman utk jalan kaki dan bermain bersama keluarga",2022-01-18 08:03:10.657287,2022
ChZDSUhNMG9nS0VJQ0FnSUM2Mkx5ekJBEAE,5,4 years ago,"Tempat yang selalu aku kunjungin ketika pulang kampung. Ngelepas stress ya di alun"".",2022-01-18 08:03:10.657287,2022
ChdDSUhNMG9nS0VJQ0FnSUNRbl9mdGxRRRAB,3,7 years ago,Bagus.. ada playground juga dan tak ketinggalan ada freewifi dari biznet,2019-01-18 08:03:10.657287,2019
ChZDSUhNMG9nS0VJQ0FnSUQycUk3Q1FnEAE,5,3 years ago,"Sejuk, Rindang, Cocok untuk jalan dan olahraga dipagi hari",2023-01-18 08:03:10.657287,2023
ChZDSUhNMG9nS0VJQ0FnSUNVc0ticGFREAE,5,6 years ago,"Sekarang cocok untuk wisata keluarga
Utamanya sore hari",2020-01-18 08:03:10.657287,2020
ChZDSUhNMG9nS0VJQ0FnSURRODVfMUZBEAE,5,8 years ago,Suasana syahdu dimalam hari,2018-01-18 08:03:10.657287,2018
ChdDSUhNMG9nS0VJQ0FnSUNRdkotSDJnRRAB,5,8 years ago,Alum-alun yang baru keren! Terdapat air mancur di sudut-sudutnya.,2018-01-18 08:03:10.657287,2018
ChZDSUhNMG9nS0VJQ0FnSUM0XzVyWUtBEAE,4,6 years ago,Tempat yang cocok untuk rekreasi keluarga dengan murah meriah,2020-01-18 08:03:10.657287,2020
ChdDSUhNMG9nS0VJQ0FnSUNvLTlyX2hRRRAB,5,6 years ago,Cukup menyenangkan,2020-01-18 08:03:10.657287,2020
ChZDSUhNMG9nS0VJQ0FnSURIbjdMb0ZREAE,5,a year ago,Sangat bagus untuk tempat tongkrongan,2025-01-18 08:03:10.657287,2025
ChdDSUhNMG9nS0VJQ0FnSUN3eElpN3pnRRAB,5,8 years ago,Terletak di tengah kota sebagai salah satu ruang terbuka hijau yg cukup representatif,2018-01-18 08:03:10.657287,2018
ChdDSUhNMG9nS0VJQ0FnSURrM2J1d3hBRRAB,5,6 years ago,"Fasilitas lengkap. Alun alun terbaik, tolong ikut dijaga ya fasilitas nya",2020-01-18 08:03:10.657287,2020
ChdDSUhNMG9nS0VJQ0FnSUNBX2FmNWhnRRAB,5,8 years ago,"Mantap dah, main² lah kesini, dan nikmati keindahan dan kesejukannya.
I like Lumajang.",2018-01-18 08:03:10.657287,2018
ChdDSUhNMG9nS0VJQ0FnSUNBd2Rla3lRRRAB,5,7 years ago,Semakin bagus alun alun lumajang sekarang...ada play ground nya jg,2019-01-18 08:03:10.657287,2019
ChdDSUhNMG9nS0VJQ0FnSURRby1UUjdRRRAB,5,7 years ago,Karena tempatx sangat menarik untuk ank maupun orng dewesa,2019-01-18 08:03:10.657287,2019
ChdDSUhNMG9nS0VJQ0FnSURNLXYtSjZnRRAB,4,6 years ago,Alun alun yang indah....sayang kalau tidak menjaga dengan sadar buang sampah pada tempatnnya,2020-01-18 08:03:10.657287,2020
ChZDSUhNMG9nS0VJQ0FnSURZcmVpcmVREAE,5,6 years ago,Tempat yg indah untuk bermain dan berteduh jg jalan jalan,2020-01-18 08:03:10.657287,2020
ChZDSUhNMG9nS0VJQ0FnSUNPN2NfZGV3EAE,5,3 years ago,Rumput nya hijau cocok untuk foto² bersama teman,2023-01-18 08:03:10.657287,2023
ChZDSUhNMG9nS0VJQ0FnSURVbW9PRFRREAE,5,6 years ago,"Taman kota indah, sejuk, asri dan bersih serta nyaman untuk bersantai""",2020-01-18 08:03:10.657287,2020
ChdDSUhNMG9nS0VJQ0FnSUNnM3JLSGtnRRAB,5,Edited 9 years ago,"Alun Alunnya sekarang bagus sekali, ramai gak kayak dulu gelap sepi",2026-01-18 08:03:10.659870,2026
ChdDSUhNMG9nS0VJQ0FnSURRbDRDSzhBRRAB,5,7 years ago,bagus ada tempat bermain buat anak-anak,2019-01-18 08:03:10.659870,2019
ChZDSUhNMG9nS0VJQ0FnSURUa2U3bWJBEAE,5,a year ago,Nyaman untuk keluarga khususnya anak-anak,2025-01-18 08:03:10.659870,2025
ChZDSUhNMG9nS0VJQ0FnSURBODdhQUN3EAE,4,8 years ago,"Terlihat asri dan sejuk, dekat dengan masjid, dinkes, polres, pemda, sel tahanan, kuliner, kodim, bank BNI",2018-01-18 08:03:10.659870,2018
ChZDSUhNMG9nS0VJQ0FnSUQwM05TVFJREAE,5,6 years ago,Tempat yang cocok untuk refresing keluarga...murah meriah,2020-01-18 08:03:10.659870,2020
ChZDSUhNMG9nS0VJQ0FnSUNvbGNDaWJREAE,5,7 years ago,Tempat nya bagus besih cocok buat selfie.,2019-01-18 08:03:10.659870,2019
Ci9DQUlRQUNvZENodHljRjlvT2xSb1ZEVlliVGh0U1hSeVRVbGZOamhuZUZwb2FXYxAB,5,7 months ago,Tempat untuk bersantai,2025-06-18 08:03:10.659870,2025
ChdDSUhNMG9nS0VJQ0FnSURnay1UeG9nRRAB,5,Edited 6 years ago,Cocok buat anak umur 6 sampai 12th dan para muda mudi,2026-01-18 08:03:10.659870,2026
ChdDSUhNMG9nS0VJQ0FnSUR6dl9hNDRRRRAB,5,a year ago,Taman yg bagus dan fasilitas lengkap,2025-01-18 08:03:10.659870,2025
ChZDSUhNMG9nS0VJQ0FnSURwa3RPWUtnEAE,5,2 years ago,Tempat utk bersantai..dan dekat dekat mesjid,2024-01-18 08:03:10.659870,2024
ChZDSUhNMG9nS0VJQ0FnSUNRamNtWWJ3EAE,4,Edited 2 years ago,On progress to develop phase 2 on the southern part. Hopefully it will more well organize and usefull for the community,2026-01-18 08:03:10.659870,2026
ChdDSUhNMG9nS0VJQ0FnSUR1eGFIQ3dBRRAB,5,3 years ago,Nice place,2023-01-18 08:03:10.659870,2023
ChZDSUhNMG9nS0VJQ0FnSUMwNU9TUkVnEAE,4,6 years ago,Bagus untuk tempat bermain anak remaja maupun lansia.,2020-01-18 08:03:10.659870,2020
ChZDSUhNMG9nS0VJQ0FnSUNBMHRTNUZ3EAE,5,8 years ago,Alun alun lumajang sangatlah indah bagus dan suasananya harmonis banget...memang lumaja sae I LIKE LUMAJANG,2018-01-18 08:03:10.659870,2018
ChZDSUhNMG9nS0VJQ0FnSURnLTgzME5REAE,4,7 years ago,"Bagus untuk jalan2/bersepeda bersama kiddos, karena lapang  dan teduh.",2019-01-18 08:03:10.659870,2019
ChZDSUhNMG9nS0VJQ0FnSURBcklhRlpREAE,4,8 years ago,Alun2 yg lumayan bersih dan bagus buat ntantai,2018-01-18 08:03:10.659870,2018
ChZDSUhNMG9nS0VJQ0FnSUM0OVlEZ1VBEAE,5,6 years ago,Tempat yg indah...sejuuk..krasaaan bangett,2020-01-18 08:03:10.659870,2020
ChdDSUhNMG9nS0VJQ0FnSUNrejdUVzNBRRAB,5,6 years ago,"Sangat rindang, anda akan dimanjakan angin sepoi sepoi yang sejuk",2020-01-18 08:03:10.659870,2020
ChZDSUhNMG9nS0VJQ0FnSUNDcGFUa1FBEAE,5,5 years ago,Jogging maupun CFDiyan... kesini aja... bisa santai sambil belanja,2021-01-18 08:03:10.659870,2021
Ci9DQUlRQUNvZENodHljRjlvT2poT09XcGlhRFl5TmxoYWVqVmhTMUp5V1d4VmNVRRAB,5,4 months ago,Mantap,2025-09-18 08:03:10.659870,2025
ChZDSUhNMG9nS0VJQ0FnSURzcVBIbmNBEAE,5,5 years ago,"Ingin bersantai bersama keluarga, Alun Alun Lumajang bisa menjadi solusi yg terbaik😊😊 …",2021-01-18 08:03:10.659870,2021
ChZDSUhNMG9nS0VJQ0FnSURZeF96V0JREAE,5,6 years ago,Sangat nyaman untuk bersantai dan tempat bermain anak anak,2020-01-18 08:03:10.659870,2020
ChdDSUhNMG9nS0VJQ0FnSURtaVpmVDVBRRAB,5,3 years ago,Alun alun yg berubah menjadi baik.. oleh sang punggawa cak thoriq,2023-01-18 08:03:10.659870,2023
ChZDSUhNMG9nS0VJQ0FnSUNnci1LLVJnEAE,3,7 years ago,Sangat cocok untuk tongkrongan bersama keluarga di malam hari,2019-01-18 08:03:10.659870,2019
Ci9DQUlRQUNvZENodHljRjlvT2s5RlgxSlNVRlF5VHpSWVpXTkljM1JuU1VKbFgzYxAB,5,4 months ago,Keren,2025-09-18 08:03:10.659870,2025
ChZDSUhNMG9nS0VJQ0FnSURReEx6MWVREAE,5,7 years ago,"Bagus,  renovasinya keren gak seperti dulu lagi",2019-01-18 08:03:10.659870,2019
ChZDSUhNMG9nS0VJQ0FnSUN3dHJ6SmR3EAE,4,8 years ago,Kalau sore hari suasana sangat nyaman. Didukung rumput rumput hujau dsini,2018-01-18 08:03:10.659870,2018
ChZDSUhNMG9nS0VJQ0FnSUNCMUpMOUtREAE,5,3 years ago,Luas banget alon²nya... nyaman banget berada di sini,2023-01-18 08:03:10.659870,2023
ChdDSUhNMG9nS0VJQ0FnSUROMllxWGdBRRAB,5,a year ago,Bersih nyaman masjid nya bagus,2025-01-18 08:03:10.659870,2025
ChdDSUhNMG9nS0VJQ0FnSUNzcjVpZ293RRAB,5,5 years ago,Tempat bermain yg dilengkapi fasilitas olah raga,2021-01-18 08:03:10.659870,2021
ChdDSUhNMG9nS0VJQ0FnSURvM29XbnJBRRAB,5,6 years ago,"Tempatnya bersih,ada playground juga buat anak anak",2020-01-18 08:03:10.659870,2020
ChZDSUhNMG9nS0VJQ0FnSUNzbjl6RktBEAE,5,5 years ago,"Tempatnya dingin dan asri, enak buat istirahat",2021-01-18 08:03:10.659870,2021
ChZDSUhNMG9nS0VJQ0FnSURDeUoyZUhBEAE,4,5 years ago,"Tempatnya bagus, bersih tapi untuk air mancurnya jarang di nyalain",2021-01-18 08:03:10.659870,2021
ChZDSUhNMG9nS0VJQ0FnSURLOTlEd2Z3EAE,4,4 years ago,Menarik....asal lampu² nya hidup semua,2022-01-18 08:03:10.659870,2022
ChdDSUhNMG9nS0VJQ0FnSUNJMXM2ODB3RRAB,5,7 years ago,Alun - alun nya sangat enak untuk tempat Hang out bareng sama temen dan keluarga,2019-01-18 08:03:10.659870,2019
ChdDSUhNMG9nS0VJQ0FnSURZNWV5WXJnRRAB,4,6 years ago,"Alun"" kotanya asri. Namun susah markir kendaraan. Apalagi ongkos parkirnya lumayan 😅 …",2020-01-18 08:03:10.659870,2020
ChdDSUhNMG9nS0VJQ0FnSURBZ05tdnZRRRAB,4,8 years ago,Penampilan tambah ok...... Cocok untuk anak anak bermain,2018-01-18 08:03:10.659870,2018
ChZDSUhNMG9nS0VJQ0FnSUNJb3RmbktnEAE,5,7 years ago,Bagus luas anak anak suka bermain di playlandnya,2019-01-18 08:03:10.659870,2019
ChdDSUhNMG9nS0VJQ0FnSURPaWVITF93RRAB,5,3 years ago,Beraih dan tempat parkirnya stratgis dekat dengan mesjid...,2023-01-18 08:03:10.659870,2023
ChdDSUhNMG9nS0VJQ0FnSURCMVlxaDN3RRAB,4,2 years ago,Ruang Terbuka Santai. Gratis. Hawanya Sejuk..,2024-01-18 08:03:10.659870,2024
ChZDSUhNMG9nS0VJQ0FnSUN5bjRxOGRREAE,5,4 years ago,"Banyak wahana bermainan anak-anak dan  tempat olahraga,taman",2022-01-18 08:03:10.659870,2022
ChZDSUhNMG9nS0VJQ0FnSURxdHBfVktBEAE,5,4 years ago,"Alun alun lumajang bersih, banyak yang jualan makanan disitu. Masjid juga ada.",2022-01-18 08:03:10.659870,2022
ChdDSUhNMG9nS0VJQ0FnSURBcjlyaV9RRRAB,5,8 years ago,Lokasi dgn 4 macam air mancur yg indah di setiap sudut alun alun.,2018-01-18 08:03:10.659870,2018
ChdDSUhNMG9nS0VJQ0FnSUNRd19ybHdnRRAB,2,9 years ago,"Kurang menarik, coba dibikin kayak alun2 Kota Batu atau Malang, pasti lebih ramai",2017-01-18 08:03:10.659870,2017
ChdDSUhNMG9nS0VJQ0FnSUNlb18yQzRBRRAB,5,3 years ago,Alun2 terbersih dan rapi yg pernah saya kunjungi,2023-01-18 08:03:10.659870,2023
ChdDSUhNMG9nS0VJQ0FnSURJNHBuYXB3RRAB,5,7 years ago,Tempatnya nyaman .cocok utk hiburan kluarga,2019-01-18 08:03:10.659870,2019
ChZDSUhNMG9nS0VJQ0FnSUNOci0zWkt3EAE,5,a year ago,"𝐌𝐚𝐤𝐢𝐧 𝐛𝐚𝐠𝐮𝐬, 𝐦𝐚𝐤𝐢𝐧 𝐡𝐢𝐣𝐚𝐮.
𝐀𝐦𝐚𝐳𝐢𝐧𝐠 …",2025-01-18 08:03:10.659870,2025
ChdDSUhNMG9nS0VJQ0FnSUNBMF92YXR3RRAB,5,8 years ago,Wow..Terima kasih Bapak Bupati Lumajang. Sudah mau memperbaiki tempat ini.,2018-01-18 08:03:10.659870,2018
ChZDSUhNMG9nS0VJQ0FnSUMwNTdyVlB3EAE,5,Edited 3 years ago,mantul .. nongki bareng para bestie sambil cuci mata wkwk,2026-01-18 08:03:10.659870,2026
ChZDSUhNMG9nS0VJQ0FnSUNtNnFiX1ZREAE,5,4 years ago,"Relatif sepi pas kesini, adeemm banyak pohon 🌲 …",2022-01-18 08:03:10.659870,2022
ChZDSUhNMG9nS0VJQ0FnSURJNk12TU53EAE,5,7 years ago,Tempat multifungsi kabupaten lumajang,2019-01-18 08:03:10.659870,2019
ChZDSUhNMG9nS0VJQ0FnSUMxem83TUpnEAE,4,2 years ago,"Sejuk,rindang tapi parkir kurang nyaman",2024-01-18 08:03:10.659870,2024
ChdDSUhNMG9nS0VJQ0FnSURTcEtpWm9RRRAB,1,Edited 5 years ago,Tengah uda bagus tpiiiii....Barat .timur utara.selatan koyak pasar,2026-01-18 08:03:10.659870,2026
ChZDSUhNMG9nS0VJQ0FnSUNnM3FpRFZ3EAE,5,8 years ago,"Air mancur ditempat ini sangat bagus, bagus juga untuk tempat bermain anak",2018-01-18 08:03:10.659870,2018
ChZDSUhNMG9nS0VJQ0FnSUNRMGJERWJBEAE,5,Edited 7 years ago,"RTH yang asyik, ada mainan untuk anak. Olah raga juga bisa.",2026-01-18 08:03:10.659870,2026
ChdDSUhNMG9nS0VJQ0FnSUNndTZMY3VRRRAB,5,8 years ago,Alun alun Lumajang lebih Bagus dari sebelumnya.,2018-01-18 08:03:10.659870,2018
ChZDSUhNMG9nS0VJQ0FnSUROc1lQS2JBEAE,5,a year ago,Teduh dan cocok untuk bersantai bersama keluarga,2025-01-18 08:03:10.659870,2025
ChdDSUhNMG9nS0VJQ0FnSUNxcnR2cGtRRRAB,5,Edited 4 years ago,"Indah, nyaman,sejuk, cocok mulai dari anak-anak -lansia",2026-01-18 08:03:10.659870,2026
ChdDSUhNMG9nS0VJQ0FnSURrM1lmZnFnRRAB,3,6 years ago,tempat wisata keluarga gratis dengan ditemani air mancur yang bagus,2020-01-18 08:03:10.659870,2020
ChZDSUhNMG9nS0VJQ0FnSUN3d19iOFlBEAE,4,7 years ago,Alun alun Lumajang semakin bagus dan tertata rapi. Rekomendasi yang sangat bagus untuk dikunjungi saat berkunjung ke Lumajang.,2019-01-18 08:03:10.659870,2019
ChdDSUhNMG9nS0VJQ0FnTURJN003ZzdnRRAB,5,9 months ago,Alun alun Asri,2025-04-18 08:03:10.659870,2025
ChZDSUhNMG9nS0VJQ0FnSUNvMjdxTEd3EAE,5,6 years ago,"Alun-alun yang indah nggak kalah sama kota besar yang lain,sejuk,damai,aman dan makmur",2020-01-18 08:03:10.659870,2020
ChdDSUhNMG9nS0VJQ0FnSUNRbjdIVzdnRRAB,5,7 years ago,"Alun alun ini makin mempercantik diri dengan hiasan lampu,beberapa tanaman hias dll",2019-01-18 08:03:10.659870,2019
ChZDSUhNMG9nS0VJQ0FnSUMxeC1xcFhBEAE,5,2 years ago,Bagus tempat bersih nyaman👌 …,2024-01-18 08:03:10.659870,2024
ChZDSUhNMG9nS0VJQ0FnSUM4M283SE1BEAE,5,5 years ago,Tempat yang Nyaman untuk Nongkrong & Udaranya yang Suueeejuuuk & Adem..,2021-01-18 08:03:10.659870,2021
ChdDSUhNMG9nS0VJQ0FnSUQ0ei1pVXJBRRAB,4,6 years ago,"Tempat bersih, banyak kegiatan masyarakat, akses mudah",2020-01-18 08:03:10.659870,2020
ChZDSUhNMG9nS0VJQ0FnSUNRaGRIelJnEAE,5,8 years ago,Tempat hang out yg sangat nyaman teduh dan asri,2018-01-18 08:03:10.659870,2018
ChdDSUhNMG9nS0VJQ0FnSUNtbVAzYTRRRRAB,5,4 years ago,tempat bagus lumayan tuk bersantai,2022-01-18 08:03:10.659870,2022
ChdDSUhNMG9nS0VJQ0FnSUM0c1lEQmd3RRAB,5,6 years ago,Lumayan tertata,2020-01-18 08:03:10.659870,2020
ChdDSUhNMG9nS0VJQ0FnSUNCNHR1b2tnRRAB,5,3 years ago,"Bagus, cocok untuk bersantai sama keluarga",2023-01-18 08:03:10.659870,2023
ChZDSUhNMG9nS0VJQ0FnSUNtZ3ZYNEF3EAE,5,Edited 9 months ago,Indah nan bersih,2026-01-18 08:03:10.659870,2026
ChdDSUhNMG9nS0VJQ0FnSUM0OE1QWmtnRRAB,4,6 years ago,"Nice place to play with the kids.  Free playground for play, free wifi too. Green area in Lumajang",2020-01-18 08:03:10.659870,2020
ChdDSUhNMG9nS0VJQ0FnSUNjLWNpUnB3RRAB,5,5 years ago,Kebersihan tempat terjaga .. tata tempat juga nyaman dilihat,2021-01-18 08:03:10.659870,2021
ChdDSUhNMG9nS0VJQ0FnSURVXzZPUC1RRRAB,4,6 years ago,ada masjid yg sejuk suasananya bnyak pohon,2020-01-18 08:03:10.659870,2020
ChdDSUhNMG9nS0VJQ0FnSUR5MWRtcTlRRRAB,5,4 years ago,Saya suka karena lokasinya berdekatan dengan masjid agung,2022-01-18 08:03:10.659870,2022
ChdDSUhNMG9nS0VJQ0FnSURRa2RYbmdRRRAB,5,8 years ago,Rame tp enak buat yg bawa anak anak kecil,2018-01-18 08:03:10.659870,2018
